pattern_id,pattern_name,pattern_formula,example,source_channel,score,date_discovered
P001,"Specialty WARNS","[Specialty] WARNS: If Your [Body Part] [Symptom] After 60, [Hidden Cause]","Neurologist WARNS: If Your LEGS Feel HEAVY After 60, Your Body Is Missing 1 Critical Vitamin",Dr. James Hargrove,19,2026-05-16
P002,"Time Before Disaster","[X] Signs/Symptoms [Time Period] Before [Health Disaster] After 60","Signs of a Stroke 24 Hours Before the Attack",Dr. Adewale,20,2026-05-16
P003,"Body Hiding/Missing","Your Body Is [Missing/Hiding] [Number] [Critical Thing] After 60","Your Body Is Hiding 7 Diseases",Dr. James Hargrove,18,2026-05-16
P004,"NEVER Do/Eat","NEVER [Verb] These [Number] [Items] After 60 ([Consequence])","These FOUR Cheeses You Must NEVER Eat After 60",Dr. James Hargrove,19,2026-05-16
P005,"Disease Outbreak","[Disease Name]: How It Spreads and Why It's Dangerous for Seniors","Hantavirus: How It Spreads and Why It Kills So Fast",Dr. Michael Kent,20,2026-05-16
P006,"Longevity Promise","You Could Live [X] More Years After [Age] – [Action]","You Could Live 30 More Years After 65 – Try Doing This In The Morning",Dr. Michael Kent,15,2026-05-16
P007,"Doctor Won't Tell","[X] [Things] Your Doctor Won't [Do/Tell] (But [Benefit])","5 Blood Tests Your Doctor Won't Order (But Could Save Your Life)",Dr. Michael Kent,17,2026-05-16
P008,"Misdirection Reveal","[Common Symptom] After 60 Is NOT [Common Belief] — It's [True Cause]","SWOLLEN ANKLES AFTER 60 ARE NOT YOUR HEART — It's Your Lymph",Dr. Michael Kent,17,2026-05-16
P009,"List + Forbidden","[Number] [Items] That [Benefit/Harm] | [Number] [Items] to Avoid","10 Fruits That Reverse Blood Sugar | 5 Worst to Avoid",Dr. Adewale,16,2026-05-16
P010,"STOP Eating","STOP Eating These [Number] [Food Items] After 60 ([Consequence])","STOP Eating These 4 Common Fish After 60 (Causing Stroke)",Dr. James Hargrove,17,2026-05-16
P011,"Food Consequence Specific","This [Food Item] Makes Your [Body Part] [Physical Adjective] After 60 — Doctor Explains","This Breakfast Makes Your Arteries Stiff After 60 — Doctor Explains",Dr. Victor Kane (I062),18,2026-05-24
P012,"Multi-System Failure","Why Your [Body Function] Gets Worse After 60 — The [Number] Systems [Verb]","Why Your Balance Gets Worse After 60 — The 3 Systems Failing",Dr. Victor Kane (I070),18,2026-05-24
P013,"Why Mechanism Reveal","Why Your [Body Part/Function] [Symptom] After 60 — The [Hidden Mechanism] Secret","Why Your Hair Thins After 60 — The Scalp Blood Flow Secret",Dr. Victor Kane (I061),17,2026-05-24
P014,"X% Decline After Age","Your [Body Function] Dropped [X]% After [Age] — Here's What It Does to [Consequence]","Your Stomach Acid Dropped 40% After 60 — Here's What It Does to Your Meds",Dr. Victor Kane (VID-019),17,2026-05-28
P015,"Normal But Suffering","Your [Lab Value] Looks Normal After [Age] — But Your [Body Part] Are [Suffering Verb]","Your Iron Levels Look Normal After 60 — But Your Cells Are Starving",Dr. Victor Kane (VID-020),17,2026-05-28
P016,"The [Lab Test] Mask","The [Lab Test] Mask: Why Your [Test Name] [Fails Verb] After [Age]","The Ferritin Mask: Why Your Iron Test Lies After 60",Dr. Victor Kane (VID-020),16,2026-05-28
P017,"Why Medications Stop Working","Why Your Medications Stop Working After 60 — The [Mechanism] Secret","Why Your Medications Stop Working After 60 — The Stomach Acid Secret",Dr. Kane (VID-019 alt),18,2026-05-28
P018,"Authority: Pills May Be Useless","[Authority]: Your Pills May Be [Adjective] After 60 — The [Mechanism] Secret","Pharmacist: Your Pills May Be Useless After 60 — The Stomach Acid Secret",Dr. Kane (VID-019 alt),17,2026-05-28
P019,"The [Lab Test] Mask + Doctor Explains","The [Lab Test] Mask: Why Your [Test Name] [Fails Verb] After [Age] — Doctor Explains","The Ferritin Mask: Why Your Iron Test Lies After 60 — Doctor Explains",Dr. Kane (VID-020 alt),17,2026-05-28
P020,"The [Lab Test] Mask + Prediction","The [Lab Test] Mask: Why Your [Test] [Fails Verb] After [Age] — And What It Predicts","The Creatinine Mask: Why Your Kidney Test Lies After 60 — And What It Predicts",Dr. Kane (VID-022),18,2026-06-06
P021,"Specialty: Your [Body Part] After [Age] Reveals [Hidden Risk]","[Specialty]: Your [Body Part] After [Age] Can Reveal a Hidden [Risk] Risk","Cardiologist: Your Pulse After 60 Can Reveal a Hidden Stroke Risk",Dr. Kane (VID-021 alt),17,2026-06-06
P022,"Your [Test] Looks Normal After [Age] — But [Organ] Is [Failing Verb]","Your [Test] Looks Normal After [Age] — But Your [Organ] Are [Failing Verb]","Your Kidney Test Looks Normal After 60 — But Your Kidneys Are Failing",Dr. Kane (VID-022 alt),19,2026-06-06
P023,"Why Your [Body Part] [Problem] After [Age] — The [Hidden Organ] Connection Nobody Explains","Why Your [Body Part] [Problem] After [Age] — The [Hidden Organ] Connection Nobody Explains","Why Your Legs Swell After 60 — The Liver Connection Nobody Explains",VID-011,18,2026-06-06
P024,"The [Time-Based] [Solution] That [Benefit] After [Age]","The [Time-Based] [Solution] That [Benefit] After [Age]","The 90-Second Bedtime Routine That Protects Your Brain After 60",VID-009,19,2026-06-06
P025,"Your [Container/Habit] May Be [Harming Action] Your [Health Aspect] After [Age]","Your [Container/Habit] May Be [Harming Action] Your [Health Aspect] After [Age]","Your Medicine Cabinet May Be Destroying Your Vitamin D After 60",VID-014,18,2026-06-06
P026,"The [Hidden Mechanism] Secret Doctors Miss About [Symptom] After [Age]","The [Hidden Mechanism] Secret Doctors Miss About [Symptom] After [Age]","The Brain Blood Flow Secret Doctors Miss About Tinnitus After 60",VID-013,18,2026-06-06
P027,"Try This [Time-Based] [Assessment] Every [Time Period] After [Age]","Try This [Time-Based] [Assessment] Every [Time Period] After [Age]","Try This 2-Minute Balance Test Every Morning After 60",VID-010,19,2026-06-06
P028,"The [Risk/Topic] Myth After [Age] — Why [Common Belief] Isn't Always Better","The [Risk/Topic] Myth After [Age] — Why [Common Belief] Isn't Always Better","The Cholesterol Myth After 60 — Why Lower Isn't Always Better",VID-008,19,2026-06-06
P029,"[Number] [Body System]s — Only [Number] May Be Failing You After [Age]","[Number] [Body System]s — Only [Number] May Be Failing You After [Age]","3 Balance Systems — Only 1 May Be Failing You After 60",VID-010,19,2026-06-06
