idea_id,title,pillar,persona,score,hook_type,emotional_driver,urgency,competitor_evidence,thumbnail_angle,audience_pain_point,retention_mechanism,status,date_generated
I271,Your Iron Levels Look Normal After 60 — But Your Cells Are Starving,Blood Health/Nutrient Absorption/Diagnostic Gap,A,19,Medical system failure + hidden cellular deficiency + diagnostic gap,Distrust of normal test results + fear + empowerment,HIGH,I071 covers dentures+anemia. NO ONE covers functional iron deficiency with normal ferritin. Completely novel diagnostic gap. Affects 15-25% of seniors.,NORMAL IRON + CELLS STARVING + blood test visual,Persistent fatigue despite normal blood tests — dismissed by doctors,Ferritin is acute-phase reactant → inflammation elevates ferritin masking true deficiency → soluble transferrin receptor (sTfR) reveals cellular iron starvation,SCRIPT_WRITTEN,2026-06-25
I272,Why Your Bladder Shrank After 60 — The Muscle Loss Nobody Warns You About,Urological/Muscle Aging/Body Changes,B,18,Hidden anatomical change + unexpected consequence + mechanism depth,Surprise + understanding + actionable hope,HIGH,Ben owns urology (714K) but covers kidney stones and prostate — NOT bladder muscle loss. Franklin owns urology (714K) but covers embarrassing topics. NO ONE covers detrusor muscle atrophy.,BLADDER SHRINK + MUSCLE LOSS + doctor explaining,Frequent urination dismissed as just getting older — frustration with no solution,Detrusor muscle loses 20-30% mass after 60 → bladder capacity drops from 500ml to 300ml → same urine volume triggers urgency sooner → 3 pelvic floor exercises rebuild detrusor strength,PENDING_APPROVAL,2026-06-25
I273,Why Your Fingernails Curve Downward After 60 — The Lung Signal,Body Signals/Respiratory Health,B,18,Body signal + hidden organ connection + self-assessment,Curiosity + fear of undiagnosed lung disease + empowerment,HIGH,Hargrove covers nails generically — NO ONE covers nail clubbing as hypoxia/lung signal. Completely unowned.,NAIL CURVING + LUNG SIGNAL + self-check visual,Noticing nail changes but told it is cosmetic — fear of something serious underneath,Schamroth window test → digital clubbing reflects chronic peripheral hypoxia → 75-80% pulmonary origin → 2-second self-assessment protocol,PENDING_APPROVAL,2026-06-25
I274,Why Your Calf Cramps at Night After 60 — The Artery Problem in Your Legs,Leg Health/Vascular/Nocturnal Symptoms,A,18,Common painful symptom + hidden vascular mechanism + misdirection,Pain recognition + fear of PAD + relief through correct diagnosis,HIGH,Cross covers swollen ankles (35K) and leg weakness (59K). Whitmore covers leg health (42K). NO ONE covers nocturnal calf cramps as PAD signal.,CALF CRAMP + ARTERY PROBLEM + leg visual,Painful nighttime calf cramps dismissed as just low potassium — fear of undiagnosed circulation problems,PAD reduces calf blood flow → nocturnal BP drop further reduces perfusion → muscle ischemia triggers cramp → ABI self-assessment + when to see vascular specialist,PENDING_APPROVAL,2026-06-25
I275,Your Gut Bacteria Changed After 60 — Here is What It Does to Your Mood,Gut-Brain Axis/Mental Health/Microbiome,B,18,Hidden mechanism + unexpected organ connection gut to brain/mood,Surprise + understanding + hope,HIGH,Leana owns microplastics+gut. NO ONE covers gut microbiome changes to mood/depression in seniors. Completely open lane.,GUT BACTERIA + MOOD CHANGE + brain visual,Depression in seniors dismissed as psychological,Stomach acid decline 30-40% after 60 → altered microbiome → reduced Lactobacillus/Bifidobacterium → 90% serotonin made in gut → depression mechanism,PENDING_APPROVAL,2026-06-25
I276,Why Your Shoulders Freeze After 60 — The Nerve Problem in Your Neck,Joint Health/Neurological/Body Signals,B,17,Misdirection shoulder problem actually neck + mechanism reveal,Frustration + surprise + relief,HIGH,I038/I048 cover cartilage+K2. I060 covers knee cracking. NO ONE covers frozen shoulder as cervical spine issue. Completely open lane.,FROZEN SHOULDER + NERVE PROBLEM + neck visual,Frustration with frozen shoulder misdiagnosis — treating shoulder fails because source is in neck,C5-C6 disc compression → phrenic/accessory nerve dysfunction → shoulder freezes as protective mechanism → cervical decompression resolves by addressing nerve root cause,PENDING_APPROVAL,2026-06-25
I280,Why Your Dentist Can Predict Your Heart Attack,Dental-Cardiovascular Axis,Persona A,18,Unexpected authority revelation,Surprise + fear of missed warning + empowerment,HIGH,"I071 covers dentures+anemia, I123 covers dentist+brain inflammation. NO ONE connects periodontal health to cardiac prediction.",DENTIST + HEART ATTACK + dental mirror/visual,Fear of missed early heart attack warning,Periodontal pathogen migration model + what to ask dentist,SCRIPT_WRITTEN,SCRIPT_WRITTEN
I284,The Blood Test That Sees Your Arteries Ageing (After 60),Diagnostic/Cardiovascular/Predictive,Persona A,18,Predictive diagnostic + time-before-disaster,Fear of undetected atherosclerosis + hope through early detection,HIGH,"I074 covers NfL for dementia, I219 covers Lp(a). NO ONE covers GlycA NMR test for arterial inflammation.",BLOOD TEST + ARTERY AGE + inflammation visual,Fear of silent atherosclerosis,GlycA score explanation + how to request test + what number means,SCRIPT_WRITTEN,SCRIPT_WRITTEN
