idea_id,title,pillar,persona,score,hook_type,emotional_driver,urgency,competitor_evidence,thumbnail_angle,audience_pain_point,retention_mechanism,status,date_generated
I062,This Common Breakfast Makes Your Arteries Stiff After 60 — Doctor Explains,Food Warning/Cardiovascular/Mechanism Focus,B,18,Healthy food reversal + hidden vascular consequence + WHY explanation,Betrayal + fear + empowerment through mechanism knowledge,HIGH,Adewale owns general food warnings, Favor owns reheated food — NO ONE owns postprandial arterial stiffness mechanism. Glycocalyx discussion is first ever in elder-health YouTube,BREAKFAST FOOD + ARTERIES STIFF + doctor visual,Betrayal by seemingly healthy breakfast choices,Glucose spike → endothelial glycocalyx damage → arterial stiffness mechanism + 3 swap breakfast,PENDING_APPROVAL
I063,Why You Forget Names After 60 — The Brain Filing System Breaking Down,Brain/Memory/Neurological Mechanism,B,17,Specific symptom + hidden mechanism reveal + reassurance,Fear of dementia + relief + empowerment,HIGH,Kent owns general dementia medication warnings, Leana owns stem cell — NO ONE explains WHY name recall specifically fails. Universal experience for over-60s,FORGETTING NAMES + BRAIN FILING SYSTEM + relief visual,Fear of dementia + frustration with memory lapses,Hippocampal index retrieval mechanism vs storage failure (dementia) distinction + practical tip,PENDING_APPROVAL
I064,Your Doctor Checked Your Thyroid — But Missed This After 60,Body Signals/Thyroid/Diagnostic Gap,B,16,Medical system failure + hidden diagnostic gap + personal empowerment,Distrust of incomplete medical care + curiosity + urgency,HIGH,NO competitor covers thyroid testing gaps. TSH-only testing misses subclinical hypothyroidism in 15-20% of seniors. Completely unowned lane,THYROID TEST + MISSED RESULT + doctor authority,Distrust of incomplete medical testing,TSH vs Free T3/Reverse T3 ratio mechanism + what standard panels miss,PENDING_APPROVAL,2026-05-23
I065,Why Your Knees Hurt More at Night After 60 — The Fluid Cycle Nobody Explains,Joint Health/Circadian Mechanism/Pain,B,16,Specific timing symptom + hidden fluid dynamics mechanism,Frustration + understanding + actionable hope,HIGH,I038/I048 cover cartilage/vitamin K2, I060 covers cracking — NO ONE covers WHY pain worsens at night. Novel companion angle,KNEES NIGHT PAIN + FLUID CYCLE + cartilage visual,Frustration with nighttime joint pain,Synovial fluid redistribution + cartilage sponge dehydration mechanism + evening protocol,PENDING_APPROVAL
I066,Why Your Hands Shake After 60 — The Brain Circuit That's Slowing Down,Body Signals/Neurological/Brain Circuit,B,17,Common symptom + hidden brain circuit mechanism + reassurance,Fear of Parkinson's + relief + understanding,HIGH,NO competitor covers hand tremor as cerebellar circuit issue. Every senior fears Parkinson's — completely open lane,HANDS SHAKING + BRAIN CIRCUIT + authority visual,Fear of Parkinson's disease,Cerebellar Purkinje cell conduction delay mechanism + essential tremor vs Parkinson's distinction,PENDING_APPROVAL,2026-05-23
I067,The 3-Question Sleep Check That Reveals Your Heart Risk After 60,Sleep/Cardiovascular Risk/Self-Assessment,B,17,Self-test + hidden organ connection + actionable framework,Fear of heart disease + empowerment through self-knowledge,HIGH,I033 covers bedtime routine, I052 covers sleep position — NO ONE connects sleep patterns to cardiovascular risk via self-assessment,3 QUESTIONS + SLEEP + HEART RISK + doctor,Fear of undetected heart disease,Sleep apnea → intermittent hypoxia → nocturnal BP spikes → LVH mechanism + 3-question screening tool,PENDING_APPROVAL
I068,Why Your Skin Bruises So Easily After 60 — The Collagen Truth,Body Signals/Skin/Connective Tissue Aging,B,15,Common symptom + hidden structural mechanism + actionable solution,Concern about fragility + understanding + hope,HIGH,NO competitor covers easy bruising as collagen/capillary wall issue. Completely open lane. Universal experience,EASY BRUISING + COLLAGEN + skin visual,Concern about skin fragility and bruising,Collagen type IV capillary wall scaffolding mechanism + vitamin C/copper cofactor deficiency angle,PENDING_APPROVAL,2026-05-23
I069,Why You Feel Cold All the Time After 60 — The Mitochondria Slowdown,Body Signals/Metabolic/Mitochondrial Function,B,16,Universal symptom + hidden cellular mechanism + actionable hope,Frustration + understanding + empowerment,HIGH,NO competitor covers cold intolerance as mitochondrial issue. Completely open lane. Every senior experiences this,FEELING COLD + MITOCHONDRIA + cellular visual,Frustration with constant cold sensation,Mitochondrial density + uncoupling protein efficiency decline mechanism + cellular furnace analogy,PENDING_APPROVAL,2026-05-23
I070,Why Your Balance Is Getting Worse After 60 — The 3 Systems Failing Together,Fall Prevention/Multi-System Aging,B,18,Fear of falling + hidden multi-system mechanism + actionable protocol,Fear of falling + understanding + specific action,I055 covers fall risk self-assessment — NO ONE explains WHY balance fails as 3-system problem. Mechanism companion to assessment idea,BALANCE FAILING + 3 SYSTEMS + doctor demonstrating,Fear of falling and loss of independence,Vestibular + proprioceptive + visual triad mechanism + why brain cant compensate when 2 of 3 fail,PENDING_APPROVAL,2026-05-23\r,
I071,Why Your Dentures Are Making You Anemic After 60 (Doctor Explains),Dental Health/Nutrient Absorption/Body Signals,B,18,Hidden danger in everyday object + nutrient depletion reveal,Betrayal + fear + empowerment,HIGH,ZERO competition. No competitor covers oral health to systemic nutrient deficiency. Dental health completely unowned in elder-health YouTube.,DENTURES + ANEMIA + doctor explaining,Concern about fatigue being dismissed as aging,Ill-fitting dentures reduce chewing efficiency 75 percent → food texture avoidance → dietary iron narrowing → microcytic anemia mechanism,SCRIPT_WRITTEN,2026-05-25\r
I072,Your Gut Bacteria Changed After 60 — Here's What It Does to Your Mood,Gut-Brain Axis/Mental Health/Microbiome,B,18,Hidden mechanism + unexpected organ connection gut to brain/mood,Surprise + understanding + hope,HIGH,Leana owns microplastics+gut. NO ONE covers gut microbiome changes to mood/depression in seniors. Completely open lane.,GUT BACTERIA + MOOD CHANGE + brain visual,Depression in seniors dismissed as psychological,Stomach acid decline 30-40 percent after 60 → altered microbiome → reduced Lactobacillus/Bifidobacterium → 90 percent serotonin made in gut → depression mechanism,PENDING_APPROVAL,2026-05-25\r
I073,Why Your Reading Glasses Prescription Keeps Changing After 60,Vision/Body Signals/Metabolic Health,B,17,Common frustration + hidden systemic cause reveal,Frustration recognition + curiosity + empowerment,HIGH,Harrison owns general eye health. NO ONE covers WHY prescriptions change — the metabolic mechanism behind lens swelling. Completely different from eye health warnings.,GLASSES PRESCRIPTION + CHANGING + doctor authority,Frustration with frequent prescription changes,Lens is glucose-sensitive organ → fluctuating blood sugar causes lens swelling/shrinking → refractive index changes → prescription instability mechanism,PENDING_APPROVAL,2026-05-25\r
I074,This Blood Test Predicts Your Memory 10 Years Before Symptoms,Brain/Predictive Diagnostics/Prevention,A,19,Predictive diagnostic + time-before-disaster + empowerment,Fear of dementia + hope through early detection + urgency,EXTREME,Kent owns medication+dementia warnings. Leana owns stem cell+anti-aging. NO ONE covers predictive blood biomarkers for cognitive decline. Completely unowned.,BLOOD TEST + MEMORY PREDICTION + 10 YEARS + doctor authority,Fear of dementia + desire for early detection,Neurofilament Light Chain (NfL) blood biomarker rises 10-15 years before clinical dementia → measures axonal damage → simple blood draw reveals neurodegeneration decade early mechanism,SCRIPT_WRITTEN,2026-05-25\r
I075,Why Your Shoulders Freeze After 60 — The Nerve Problem in Your Neck,Joint Health/Neurological/Body Signals,B,17,Misdirection shoulder problem actually neck + mechanism reveal,Frustration + surprise + relief,HIGH,I038/I048 cover cartilage+K2. I060 covers knee cracking. NO ONE covers frozen shoulder as cervical spine issue. Completely open lane.,FROZEN SHOULDER + NERVE PROBLEM + neck visual,Frustless with frozen shoulder misdiagnosis,C5-C6 disc compression → phrenic/accessory nerve dysfunction → shoulder freezes as protective mechanism → treating shoulder fails because neck is source,PENDING_APPROVAL,2026-05-25\r
I076,The 4PM Energy Crash After 60 — Your Adrenals Aren't Tired Here's Why,Energy/Hormonal Health/Circadian Rhythm,B,17,Common symptom + mechanism correction it's not what you think,Frustration recognition + curiosity + empowerment,HIGH,I036 covers 3AM waking+cortisol. I069 covers feeling cold+mitochondria. NO ONE covers 4PM energy crash specifically. Completely open lane.,4PM ENERGY CRASH + CORTISOL + doctor explaining,Frustration with afternoon exhaustion,Cortisol circadian misalignment + insulin sensitivity timing → two circadian systems failing simultaneously → afternoon glucose+cortisol double crash mechanism,PENDING_APPROVAL,2026-05-25\r
I077,Why Your Hearing Aids Make You Tired After 60 — The Brain Load Problem,Hearing/Brain Health/Cognitive Load,B,18,Hidden consequence of common assistive device + brain mechanism,Surprise + understanding + actionable hope,HIGH,I051 covers tinnitus+brain blood flow. NO ONE covers hearing aid fatigue. 70+ percent of seniors with hearing aids report fatigue. Completely novel.,HEARING AIDS + TIRED + brain load visual,Fatigue from hearing aid use,Hearing aids amplify everything not just sound → reduced GABA in auditory cortex → brain can't filter signal from noise → cognitive load exhausts seniors mechanism,PENDING_APPROVAL,2026-05-25\r
I078,Your Liver Processes Drugs Differently After 60 — The 30% Rule,Medication Safety/Liver Function/Pharmacology,A,18,Hidden systemic change + medication safety implication,Fear + empowerment + urgency to review medications,HIGH,Kent owns general medication warnings. I035 covers BP+Magnesium. I056 covers medicine cabinet+Vit D. NO ONE covers age-related liver metabolism changes. Completely unowned.,LIVER + 30 PERCENT RULE + medication visual,Medication safety concerns,Liver blood flow decreases ~30 percent after 60 + CYP450 enzyme activity declines → drugs metabolized slower → accumulation → side effects attributed to new symptoms not drug toxicity mechanism,PENDING_APPROVAL,2026-05-25\r
I079,Why You Can't Swallow Pills After 60 — The Throat Muscle Nobody Knows,Swallowing/Neurological/Body Signals,B,17,Common frustration + hidden anatomical mechanism,Frustration recognition + surprise + practical relief,HIGH,ZERO competition. No competitor covers dysphagia in seniors. Completely open lane. Affects 15-20 percent of seniors.,PILLS STUCK + THROAT MUSCLE + doctor demonstrating,Difficulty swallowing pills,Cricopharyngeus muscle loses relaxation efficiency → reduced nitric oxide signaling → upper esophageal sphincter doesn't fully relax → pills stick → chin-tuck maneuver bypasses tight sphincter mechanism,PENDING_APPROVAL,2026-05-25\r
I080,The Lymph Node That Swells When Your Heart Is in Trouble After 60,Cardiovascular/Lymphatic System/Body Signals,A,18,Body signal + hidden organ connection + early warning system,Curiosity + fear + empowerment through self-monitoring,HIGH,I031 covers leg swelling+liver. I020/I021 cover heavy legs+lymphatic. NO ONE covers lymph node swelling as cardiac signal. Completely novel.,LYMPH NODE + HEART WARNING + self-exam visual,Desire for early heart disease detection,Virchow's node (left supraclavicular) drains thoracic duct → heart failure increases venous pressure → lymphatic congestion → thoracic duct backs up → Virchow's node swells → early warning system mechanism,PENDING_APPROVAL,2026-05-25\r
I081,Why Your Fingertips Tingle After 60 — The Spinal Cord Signal Hiding in Your Hands,Body Signals/Neurological/Spinal Health,B,18,Body signal + hidden spinal mechanism reveal,Curiosity + fear of nerve damage + relief through understanding,HIGH,ZERO competition. Hargrove covers nails, Franklin covers embarrassing topics, NO ONE covers fingertip tingling as spinal cord signal. Completely open lane. Affects 20-30% of seniors.,TINGLING FINGERTIPS + SPINAL CORD + hand/neck visual,Unexplained tingling dismissed as 'just aging' — fear it's something serious,Cervical spinal stenosis mechanism → nerve root compression → specific fingers map to specific vertebrae → self-check protocol + when to see doctor
I082,The Doctor Explains: Why Your Body Odor Changes After 60 — The Liver Signal You Can Smell,Body Signals/Liver Health/Metabolic,B,17,Embarrassing body change + hidden organ signal + mechanism reveal,Embarrassment recognition + curiosity + empowerment through self-monitoring,MEDIUM-HIGH,Franklin covers embarrassing topics but NOT body odor. NO competitor covers odor changes as liver function signal. Completely novel in elder-health YouTube.,BODY ODOR + LIVER SIGNAL + doctor explaining (tactful visual),Embarrassing body odor changes dismissed as hygiene issue — fear of social isolation,Liver detoxification decline → trimethylamine buildup → 'fishy' or 'musty' odor → 3 liver function markers to request + dietary trimethylamine reduction protocol,PENDING_APPROVAL,2026-05-28
I083,Why Your Eyelids Twitch After 60 — The Brain Stress Signal Nobody Connects,Body Signals/Neurological/Stress Response,B,17,Common annoying symptom + hidden brain mechanism + stress connection,Frustration recognition + curiosity + actionable relief,MEDIUM-HIGH,NO competitor covers eyelid twitching as neurological stress signal. Completely open lane. Universal experience — nearly everyone over 60 has experienced this.,EYELID TWITCHING + BRAIN STRESS + eye visual,Annoying eyelid twitching dismissed as 'just tired' — frustration with no explanation,Facial nerve hyperexcitability → magnesium-dependent nerve conduction → chronic stress depletes magnesium → orbicularis oculi muscle becomes hyperexcitable → 3-min evening reset protocol,PENDING_APPROVAL,2026-05-28
I084,Your Stomach Acid Dropped 40% After 60 — Here's What It Does to Your Medications,Medication Safety/Digestive Health/Pharmacology,A,19,Hidden systemic change + medication safety implication + mechanism depth,Fear + betrayal + empowerment through knowledge,HIGH,Kent owns general medication warnings (882K). I035 covers BP+Magnesium. I056 covers medicine cabinet+Vit D. I078 covers liver metabolism. NO ONE covers stomach acid decline affecting drug absorption. Completely unowned intersection.,STOMACH ACID + 40% DROP + medication visual,Medications not working as expected — fear of drug interactions without knowing WHY,Parietal cell decline → pH rises from 1.5 to 3.5+ → enteric coatings dissolve in wrong location → drug absorption drops 30-50% → specific drug classes affected + timing protocol to restore absorption,SCRIPT_WRITTEN,2026-05-28
I085,Why Your Calf Cramps at Night After 60 — The Artery Problem in Your Legs,Leg Health/Vascular/Nocturnal Symptoms,A,18,Common painful symptom + hidden vascular mechanism + misdirection (not just electrolytes),Pain recognition + fear of PAD + relief through correct diagnosis,HIGH,Cross covers swollen ankles (35K) and leg weakness (59K). Whitmore covers leg health (42K). NO ONE covers nocturnal calf cramps as peripheral artery disease signal. Completely open lane.,CALF CRAMP + ARTERY PROBLEM + leg visual,Painful nighttime calf cramps dismissed as 'just low potassium' — fear of undiagnosed circulation problems,PAD reduces blood flow to calf muscles → nocturnal BP drop further reduces perfusion → muscle ischemia triggers cramp → ankle-brachial index self-assessment + 3 vascular exercises + when to see vascular specialist,PENDING_APPROVAL,2026-05-28
I086,The Doctor Explains: Why Your Sweat Changed After 60 — The Thyroid Signal on Your Skin,Body Signals/Thyroid/Autonomic Nervous System,B,17,Body signal + hidden thyroid mechanism + autonomic nervous system connection,Curiosity + concern + empowerment through early detection,MEDIUM-HIGH,I064 covers thyroid testing gaps. NO ONE covers sweat pattern changes as thyroid signal. Completely novel angle. Every senior notices sweat changes but no one explains WHY.,SWEAT CHANGE + THYROID SIGNAL + skin/perspiration visual,Sweating too much or too little — dismissed as 'just aging' — fear of undiagnosed thyroid condition,Thyroid hormone regulates eccrine sweat gland sensitivity → hypothyroidism reduces sweat by 40% → hyperthyroidism increases night sweats → 3 sweat pattern types map to specific thyroid conditions + which blood tests to request,PENDING_APPROVAL,2026-05-28
I087,Why Your Bladder Shrank After 60 — The Muscle Loss Nobody Warns You About,Urological/Muscle Aging/Body Changes,B,18,Hidden anatomical change + unexpected consequence + mechanism depth,Surprise + understanding + actionable hope,HIGH,Ben owns urology (714K) but covers kidney stones and prostate — NOT bladder muscle loss. Franklin owns urology (714K) but covers embarrassing topics. NO ONE covers detrusor muscle atrophy. Completely unowned.,BLADDER SHRINK + MUSCLE LOSS + doctor explaining,Frequent urination dismissed as 'just getting older' — frustration with no solution offered,Detrusor muscle loses 20-30% mass after 60 → bladder capacity drops from 500ml to 300ml → same urine volume triggers urgency sooner → 3 pelvic floor exercises that rebuild detrusor strength + timing protocol,PENDING_APPROVAL,2026-05-28
I088,Your Iron Levels Look Normal After 60 — But Your Cells Are Starving (Doctor Explains),Blood Health/Nutrient Absorption/Diagnostic Gap,A,19,Medical system failure + hidden cellular deficiency + diagnostic gap,Distrust of normal test results + fear of undiagnosed condition + empowerment,HIGH,I071 covers dentures+anemia. NO ONE covers functional iron deficiency with normal ferritin. Completely novel diagnostic gap. Affects 15-25% of seniors with 'normal' blood work but persistent fatigue.,NORMAL IRON + CELLS STARVING + blood test visual,Persistent fatigue despite 'normal' blood tests — dismissed by doctors — frustration and fear,Ferritin is acute-phase reactant → inflammation elevates ferritin masking true iron deficiency → soluble transferrin receptor (sTfR) test reveals cellular iron starvation → 3 conditions that cause functional iron deficiency + sTfR test request script,SCRIPT_WRITTEN,2026-05-28
I089,Why Your Gums Recede After 60 — The Bone Loss Signal in Your Mouth,Dental Health/Bone Density/Body Signals,B,17,Common dental change + hidden systemic bone loss connection,Concern about dental health + fear of osteoporosis + empowerment through early detection,MEDIUM-HIGH,I071 covers dentures+anemia. NO ONE covers gum recession as osteoporosis signal. Completely open lane. Dental health to systemic bone loss is unowned in elder-health YouTube.,REEDING GUMS + BONE LOSS + dental visual,Receding gums dismissed as dental issue only — fear of undiagnosed osteoporosis,Alveolar bone loss mirrors systemic bone loss → gum recession is visible marker of mandibular osteoporosis → periodontal probing depth correlates with DEXA T-scores → 3 oral signs that predict low bone density + when to request DEXA scan,PENDING_APPROVAL,2026-05-28
I090,The Doctor Explains: Why Your Nose Runs After 60 — The Nerve Damage in Your Face,Body Signals/Neurological/Autonomic Nervous System,B,16,Common annoying symptom + hidden nerve mechanism + misdirection (not allergies),Frustration recognition + curiosity + relief through correct explanation,MEDIUM,NO competitor covers rhinorrhea (runny nose) as neurological signal in seniors. Completely open lane. Affects 10-15% of seniors — often misdiagnosed as allergies.,RUNNY NOSE + NERVE DAMAGE + face/nose visual,Chronic runny nose dismissed as allergies — frustration with allergy meds that don't work,Vagus nerve parasympathetic fibers innervate nasal mucosa → age-related vagal hyperexcitability → gustatory rhinorrhea (eating triggers runny nose) + non-allergic rhinitis → 3 nerve-calming techniques + when it's actually neurological vs allergic,PENDING_APPROVAL,2026-05-28
I091,Why Your Fingernails Curve Downward After 60 — The Lung Signal in Your Nails,Body Signals/Respiratory Health,B,18,Body signal + hidden organ connection + self-assessment protocol,Curiosity + fear of undiagnosed lung disease + empowerment through early detection,HIGH,Hargrove covers nails generically — NO ONE covers nail clubbing as hypoxia/lung signal. Completely unowned.,NAIL CURVING + LUNG SIGNAL + self-check visual,Noticing nail changes but told it's cosmetic — fear of something serious underneath,Schamroth's window test (press nails together — diamond gap disappears = positive) → digital clubbing reflects chronic peripheral hypoxia → pulmonary shunting → 75-80% pulmonary origin → 2-second self-assessment protocol,PENDING_APPROVAL,2026-05-28
I092,Your Doctor Checked Your Heart — But Missed This Valve After 60,Cardiovascular/Diagnostic Gap,A,18,Medical system failure + hidden diagnostic gap + authority contradiction,Distrust of incomplete cardiac workup + fear of missed diagnosis + empowerment,EXTREME,Whitmore covers heart medications (607K). Carter covers medication warnings. NO ONE covers valvular heart disease being missed on standard cardiac panels.,HEART DOCTOR + MISSED VALVE + authority visual,Fear that getting 'cleared' by cardiologist doesn't mean the valve was checked — frustration with incomplete testing,Standard cardiac workup (EKG + troponin + stress test) evaluates coronary arteries but systematically misses valvular pathology → aortic stenosis prevalence 8-13% after 75 → requires echocardiogram NOT part of standard screening → specific murmur timing that should trigger echo referral,PENDING_APPROVAL,2026-05-28
I093,Why Your Fingers Go Cold After 60 — The Artery Blockage in Your Arms,Body Signals/Vascular Health,A,17,Misdirection + vascular mechanism revelation (not PAD in legs — arms),Concern about circulation + fear of stroke + relief through understanding,HIGH,I085 covers calf cramps as PAD (legs). I054 covers Raynaud's as autoimmune. NO ONE covers finger coldness as subclavian/brachial artery stenosis.,COLD FINGERS + ARTERY BLOCKAGE + arm visual,Cold hands dismissed as poor circulation — fear it's something more serious,Subclavian steal syndrome → stenosis proximal to vertebral artery → blood stolen from brain to supply arm → contralateral arm temp differential >2°C indicates significant stenosis → bilateral arm BP comparison <20mmHg difference test,PENDING_APPROVAL,2026-05-28
I267,Your Doctor Checked Your Heart — But Missed This Valve (60+),Cardiovascular/Diagnostic Gap,A,18,Medical system failure + hidden diagnostic gap,Distrust of incomplete cardiac workup + fear + empowerment,EXTREME,Whitmore covers heart medications (607K). Carter covers medication warnings. NO ONE covers valvular heart disease being missed on standard cardiac panels.,HEART DOCTOR + MISSED VALVE + authority visual,Fear that getting cleared by cardiologist does not mean the valve was checked,Standard cardiac workup evaluates coronary arteries but systematically misses valvular pathology → aortic stenosis prevalence 8-13% after 75 → requires echocardiogram NOT part of standard screening,PENDING_APPROVAL,2026-06-25
I268,Why Your Fingertips Tingle After 60 — The Spinal Cord Signal (60+),Body Signals/Neurological/Spinal Health,B,18,Body signal + hidden spinal mechanism reveal,Curiosity + fear of nerve damage + relief through understanding,HIGH,"ZERO competition. Hargrove covers nails, Franklin covers embarrassing topics, NO ONE covers fingertip tingling as spinal cord signal. Affects 20-30% of seniors.",TINGLING FINGERTIPS + SPINAL CORD + hand/neck visual,Unexplained tingling dismissed as just aging — fear it is something serious,Cervical spinal stenosis → nerve root compression → specific fingers map to specific vertebrae → self-check protocol + when to see doctor,PENDING_APPROVAL,2026-06-25
I269,Your Stomach Acid Dropped 40% After 60 — Here is What It Does to Your Meds,Medication Safety/Digestive Health/Pharmacology,A,19,Hidden systemic change + medication safety + mechanism depth,Fear + betrayal + empowerment through knowledge,HIGH,Kent owns general medication warnings (882K). I035 covers BP+Magnesium. I078 covers liver metabolism. NO ONE covers stomach acid decline affecting drug absorption. Completely unowned intersection.,STOMACH ACID + 40% DROP + medication visual,Medications not working as expected — fear of drug interactions without knowing WHY,Parietal cell decline → pH rises from 1.5 to 3.5+ → enteric coatings dissolve in wrong location → drug absorption drops 30-50% → specific drug classes affected + timing protocol,SCRIPT_WRITTEN,2026-06-25
I270,Why Your Gums Recede After 60 — The Bone Loss Signal in Your Mouth,Dental Health/Bone Density/Body Signals,B,17,Common dental change + hidden systemic bone loss connection,Concern about dental health + fear of osteoporosis + empowerment,MEDIUM-HIGH,I071 covers dentures+anemia. NO ONE covers gum recession as osteoporosis signal. Completely open lane.,REEDING GUMS + BONE LOSS + dental visual,Receding gums dismissed as dental issue only — fear of undiagnosed osteoporosis,Alveolar bone loss mirrors systemic bone loss → gum recession is visible marker of mandibular osteoporosis → periodontal probing depth correlates with DEXA T-scores,PENDING_APPROVAL,2026-06-25
