idea_id,title,pillar,persona,score,hook_type,emotional_driver,urgency,competitor_evidence,thumbnail_angle,audience_pain_point,retention_mechanism,status,date_generated
I061,Why Your Hair Thins After 60 — The Scalp Blood Flow Secret,Body Signals/Circulation/Hair Health,B,17,Body signal + hidden vascular mechanism reveal,Curiosity + vanity fear + empowerment,HIGH,"NO competitor covers hair thinning as microcirculation issue. Hargrove covers nails, Franklin covers embarrassing topics — zero overlap. Completely open lane",HAIR THINNING + SCALP BLOOD FLOW + doctor authority,Concern about hair loss and aging appearance,Scalp capillary density drop mechanism + vascular vs hormonal cause reframing,PENDING_APPROVAL,2026-05-23
I062,This Common Breakfast Makes Your Arteries Stiff After 60 — Doctor Explains,Food Warning/Cardiovascular/Mechanism Focus,B,18,Healthy food reversal + hidden vascular consequence + WHY explanation,Betrayal + fear + empowerment through mechanism knowledge,HIGH,"Adewale owns general food warnings, Favor owns reheated food — NO ONE owns postprandial arterial stiffness mechanism. Glycocalyx discussion is first ever in elder-health YouTube",BREAKFAST FOOD + ARTERIES STIFF + doctor visual,Betrayal by seemingly healthy breakfast choices,Glucose spike → endothelial glycocalyx damage → arterial stiffness mechanism + 3 swap breakfast,PENDING_APPROVAL,2026-05-23
I063,Why You Forget Names After 60 — The Brain Filing System Breaking Down,Brain/Memory/Neurological Mechanism,B,17,Specific symptom + hidden mechanism reveal + reassurance,Fear of dementia + relief + empowerment,HIGH,"Kent owns general dementia medication warnings, Leana owns stem cell — NO ONE explains WHY name recall specifically fails. Universal experience for over-60s",FORGETTING NAMES + BRAIN FILING SYSTEM + relief visual,Fear of dementia + frustration with memory lapses,Hippocampal index retrieval mechanism vs storage failure (dementia) distinction + practical tip,PENDING_APPROVAL,2026-05-23
I064,Your Doctor Checked Your Thyroid — But Missed This After 60,Body Signals/Thyroid/Diagnostic Gap,B,16,Medical system failure + hidden diagnostic gap + personal empowerment,Distrust of incomplete medical care + curiosity + urgency,HIGH,NO competitor covers thyroid testing gaps. TSH-only testing misses subclinical hypothyroidism in 15-20% of seniors. Completely unowned lane,THYROID TEST + MISSED RESULT + doctor authority,Distrust of incomplete medical testing,TSH vs Free T3/Reverse T3 ratio mechanism + what standard panels miss,PENDING_APPROVAL,2026-05-23
I065,Why Your Knees Hurt More at Night After 60 — The Fluid Cycle Nobody Explains,Joint Health/Circadian Mechanism/Pain,B,16,Specific timing symptom + hidden fluid dynamics mechanism,Frustration + understanding + actionable hope,HIGH,"I038/I048 cover cartilage/vitamin K2, I060 covers cracking — NO ONE covers WHY pain worsens at night. Novel companion angle",KNEES NIGHT PAIN + FLUID CYCLE + cartilage visual,Frustration with nighttime joint pain,Synovial fluid redistribution + cartilage sponge dehydration mechanism + evening protocol,PENDING_APPROVAL,2026-05-23
I066,Why Your Hands Shake After 60 — The Brain Circuit That's Slowing Down,Body Signals/Neurological/Brain Circuit,B,17,Common symptom + hidden brain circuit mechanism + reassurance,Fear of Parkinson's + relief + understanding,HIGH,NO competitor covers hand tremor as cerebellar circuit issue. Every senior fears Parkinson's — completely open lane,HANDS SHAKING + BRAIN CIRCUIT + authority visual,Fear of Parkinson's disease,Cerebellar Purkinje cell conduction delay mechanism + essential tremor vs Parkinson's distinction,PENDING_APPROVAL,2026-05-23
I067,The 3-Question Sleep Check That Reveals Your Heart Risk After 60,Sleep/Cardiovascular Risk/Self-Assessment,B,17,Self-test + hidden organ connection + actionable framework,Fear of heart disease + empowerment through self-knowledge,HIGH,"I033 covers bedtime routine, I052 covers sleep position — NO ONE connects sleep patterns to cardiovascular risk via self-assessment",3 QUESTIONS + SLEEP + HEART RISK + doctor,Fear of undetected heart disease,Sleep apnea → intermittent hypoxia → nocturnal BP spikes → LVH mechanism + 3-question screening tool,PENDING_APPROVAL,2026-05-23
I068,Why Your Skin Bruises So Easily After 60 — The Collagen Truth,Body Signals/Skin/Connective Tissue Aging,B,15,Common symptom + hidden structural mechanism + actionable solution,Concern about fragility + understanding + hope,HIGH,NO competitor covers easy bruising as collagen/capillary wall issue. Completely open lane. Universal experience,EASY BRUISING + COLLAGEN + skin visual,Concern about skin fragility and bruising,Collagen type IV capillary wall scaffolding mechanism + vitamin C/copper cofactor deficiency angle,PENDING_APPROVAL,2026-05-23
I069,Why You Feel Cold All the Time After 60 — The Mitochondria Slowdown,Body Signals/Metabolic/Mitochondrial Function,B,16,Universal symptom + hidden cellular mechanism + actionable hope,Frustration + understanding + empowerment,HIGH,NO competitor covers cold intolerance as mitochondrial issue. Completely open lane. Every senior experiences this,FEELING COLD + MITOCHONDRIA + cellular visual,Frustration with constant cold sensation,Mitochondrial density + uncoupling protein efficiency decline mechanism + cellular furnace analogy,PENDING_APPROVAL,2026-05-23
I070,Why Your Balance Is Getting Worse After 60 — The 3 Systems Failing Together,Fall Prevention/Multi-System Aging,B,18,Fear of falling + hidden multi-system mechanism + actionable protocol,Fear of falling + understanding + specific action,I055 covers fall risk self-assessment — NO ONE explains WHY balance fails as 3-system problem. Mechanism companion to assessment idea,BALANCE FAILING + 3 SYSTEMS + doctor demonstrating,Fear of falling and loss of independence,Vestibular + proprioceptive + visual triad mechanism + why brain cant compensate when 2 of 3 fail,PENDING_APPROVAL,2026-05-23
